{
  "schemaVersion": "ingest-connector-mcp-preview/v1",
  "generatedAt": "2026-04-27T12:00:03.000Z",
  "connectorId": "local.files",
  "localOnly": true,
  "dryRun": true,
  "request": {
    "maxItems": 2,
    "maxTextBytes": 128
  },
  "resources": [
    {
      "schemaVersion": "ingest-connector-mcp-resource/v1",
      "generatedAt": "2026-04-27T12:00:01.000Z",
      "connectorId": "local.files",
      "localOnly": true,
      "resource": {
        "id": "notes",
        "uri": "ingest://local.files/resources/notes",
        "name": "Release Notes",
        "description": "Local release notes prepared for offline indexing.",
        "mimeType": "text/markdown",
        "textBytes": 39
      },
      "content": {
        "type": "text",
        "text": "Release notes ready for local indexing.",
        "truncated": false
      }
    },
    {
      "schemaVersion": "ingest-connector-mcp-resource/v1",
      "generatedAt": "2026-04-27T12:00:02.000Z",
      "connectorId": "local.files",
      "localOnly": true,
      "resource": {
        "id": "summary",
        "uri": "ingest://local.files/resources/summary",
        "name": "JSON Summary",
        "description": "Sanitized summary document for local preview.",
        "mimeType": "application/json",
        "textBytes": 28
      },
      "content": {
        "type": "text",
        "text": "{\"status\":\"ready\",\"items\":2}",
        "truncated": false
      }
    }
  ],
  "summary": {
    "resourceCount": 2,
    "totalTextBytes": 67,
    "truncated": false
  }
}
